{
  "schema_version": "1.0.0",
  "eval_id": "bev_skill_effectiveness_2026_10_21_baseline",
  "created_at": "2026-10-21T03:35:46.505Z",
  "variant": "BASELINE",
  "subject": {
    "kind": "routing_profile",
    "ref": "maws-workflow-core-router-profile"
  },
  "model_run": {
    "mode": "recorded_replay",
    "isolated": true,
    "executor_ref": "recorded_corpus_transcripts",
    "isolation_envelope": {
      "workspace_write": "none",
      "network": "deny",
      "inherited_qualification": "none",
      "allowed_effects": []
    }
  },
  "case_families": [
    {
      "family": "positive",
      "blocking": true,
      "corpus_digest": "sha256:1683b8d781e6df1189c1769b8b93c247d0ee980b1fb2c1170faa0d7d3d503d01",
      "cases_total": 3,
      "cases_passed": 2,
      "cases_failed": 1
    },
    {
      "family": "negative",
      "blocking": true,
      "corpus_digest": "sha256:e87e4a58c20547de229b98218a5e636a909a1ce7bca59413b53bff012a9de48d",
      "cases_total": 3,
      "cases_passed": 3,
      "cases_failed": 0
    },
    {
      "family": "security_regression",
      "blocking": true,
      "corpus_digest": "sha256:c548d38ec5d55350d8bc1d6795b22e8ce580289f52407b9e56ed97487f744f5c",
      "cases_total": 3,
      "cases_passed": 3,
      "cases_failed": 0
    },
    {
      "family": "model_parity",
      "blocking": false,
      "corpus_digest": "sha256:315f04f682e0c9a3d10e6a2d99fa2983cd121caef99fb2e00c779f2fc431aa96",
      "cases_total": 2,
      "cases_passed": 1,
      "cases_failed": 1
    }
  ],
  "metrics": {
    "routing": {
      "decisions_expected": 11,
      "decisions_matched": 10
    },
    "output": {
      "assertions_total": 16,
      "assertions_passed": 14
    },
    "cost": {
      "tokens_in": 8190,
      "tokens_out": 1721,
      "cost_units": 0.0199
    },
    "latency": {
      "latency_ms_max": 1240
    }
  },
  "security_gate": {
    "security_cases_total": 3,
    "security_regressions": 0,
    "gate": "PASS"
  },
  "verdict": "BASELINE_RECORDED",
  "reproducibility": {
    "corpus_ref": "skill-effectiveness",
    "corpus_digest": "sha256:937478a9903ceb6a439e7e77a459a8d3a86b52f06a98a4467aea1bf97af42fc9",
    "runner": "run-skill-effectiveness-evals.mjs",
    "content_digest": "sha256:1ddaef6d1dd179ef154bff0ce342cf663c76befdee0b510529ea0d6393380a07"
  },
  "evidence_refs": [
    "corpus:skill-effectiveness"
  ]
}
